{
  "$schema": "https://srs.semanticops.com/schema/2.0/record.json",
  "instanceId": "af489a79-3748-56a7-b21d-916da4a2ce08",
  "typeId": "31a5a746-d2d6-5c56-a4b3-10fa07483a73",
  "typeVersion": 1,
  "typeNamespace": "com.semanticops.srs",
  "typeName": "meta.type-definition",
  "fieldValues": [
    {
      "fieldId": "96f04d9d-9432-5628-8664-0d92e50f6fd0",
      "value": "container"
    },
    {
      "fieldId": "436786e4-d51e-5275-9654-bc4b5ee82b1a",
      "value": "A lightweight grouping boundary over a collection of instances. Containers answer scoping questions — which instances belong together, what constitutes \"this project\" — that the Relation graph alone cannot answer.\n\nContainers are not semantic objects with Fields. They do not own semantic state; Records do. A `contains` Relation asserts \"A is part of B\" (a semantic claim); a Container asserts \"these instances form a unit for boundary purposes\" (a scope claim). Both are needed; neither replaces the other.\n\n```typescript\n{\n  containerId: UUID\n\n  namespace?: string\n  name?: string\n\n  title: string              // human-readable label\n\n  containerType?: string     // free-form hint; e.g. \"project\", \"meeting\", \"sprint\"\n\n  rootInstanceIds?: UUID[]\n  // Top-level instances this Container was created to hold. Implementations may\n  // derive nested members by traversing contains Relations from these roots.\n\n  memberInstanceIds?: UUID[]\n  // Explicit membership list for all instances in scope.\n  // When present, allows membership queries without graph traversal.\n  // When omitted, membership is defined by traversing contains Relations.\n\n  createdAt?: ISO8601\n  updatedAt?: ISO8601\n  meta?: Record<string, unknown>\n}\n```\n\n`Container.containerId` is not an instance ID and must not appear in `Relation.sourceInstanceId` or `targetInstanceId`. See Invariant 19.\n\n---"
    }
  ],
  "sourceRefs": [
    {
      "sourceType": "repository-document",
      "sourceId": "a1b2c3d4-e5f6-4a7b-8c9d-0e1f2a3b4c5d",
      "relationType": "evidence",
      "note": "Type definition container from srs-spec.md - coarse source anchoring during migration"
    }
  ],
  "createdAt": "2026-05-27T00:00:00Z"
}
