{
  "$schema": "https://srs.semanticops.com/schema/2.0/record.json",
  "createdAt": "2026-07-02T20:43:25.993095483+00:00",
  "fieldValues": [
    {
      "fieldId": "1a000001-0000-4000-a000-000000000001",
      "value": "RFC-014: Import Tracking & Package Binding"
    },
    {
      "fieldId": "5a000001-0000-4000-a000-000000000001",
      "value": "014"
    },
    {
      "fieldId": "5a000002-0000-4000-a000-000000000002",
      "value": "in-progress"
    },
    {
      "fieldId": "5a000003-0000-4000-a000-000000000003",
      "value": "Peter Brownell"
    },
    {
      "fieldId": "5a000009-0000-4000-a000-000000000009",
      "value": "`Package`, `PackageRef`, `UpstreamPackage` (Distribution Group); `ext:import-tracking`; `manifest.json` schema"
    },
    {
      "fieldId": "5a000016-0000-4000-a000-000000000016",
      "value": "rfcs/rfc-014-import-tracking-package-binding.md"
    },
    {
      "fieldId": "1a000002-0000-4000-a000-000000000002",
      "value": "Formalises the minimum viable provenance and upgrade contract for SRS repositories created from upstream packages.\n\n**Problems addressed:** (1) `meta.upstreamPackage` is informal â€” stored in the non-normative `meta` object, tools may ignore it. (2) Upgrade semantics are unspecified â€” no spec guidance on whether old package versions must be retained when a new version is installed. (3) Divergence detection has no formal definition â€” `ImportRecord.conflictState: \"diverged\"` exists but its trigger and meaning at the repository level are undefined.\n\n**Changes:** (A) Promotes `upstreamPackage` from `manifest.meta` to a first-class top-level manifest property. (B) Removes the `external`-mode restriction from `PackageRef.packageVersion` and `PackageRef.packageId`, making both applicable to local-mode entries. (C) Specifies multi-version install semantics: prior `PackageRef` entries MUST be retained when a new version is installed (install-alongside, not replace). (D) Makes record-definition version pinning normative: tools MUST NOT rewrite `typeId`/`fieldId`/`fieldValues` as a result of a package upgrade. (E) Defines repository-level divergence detection: when `upstreamPackage` is set, a tool MAY compare locally installed definition files against a reference copy and populate `ImportRecord.conflictState: \"diverged\"` for differing definitions.\n\n**Scope exclusions:** registry distribution (`ext:registry`), federation (`ext:federation`), package authoring workflows, and upstream-ahead detection (requires registry access). These remain in RFC-003.\n\n**Conformance rules:** R1â€“R10. Key structural rules: R6 extends Invariant 50 to multi-version repos (union resolution); R10 requires `upstreamPackage.packageId` to match a `PackageRef` entry.\n\n**GitHub issue:** srs#109. Gates srs-rust#234 (Gate 0) and muDemocracy.org#37."
    }
  ],
  "instanceId": "3108c113-361c-4f67-a2ef-b8d92b220a1f",
  "typeId": "6a000001-0000-4000-a000-000000000001",
  "typeName": "rfc",
  "typeNamespace": "com.semanticops.spec",
  "typeVersion": 1,
  "updatedAt": "2026-07-02T20:43:25.993109375+00:00"
}
