{
  "createdAt": "2026-05-31T14:55:35.188976549+00:00",
  "fieldValues": [
    {
      "fieldId": "60be1468-01bc-5d12-9eea-628f02801893",
      "value": "A-005"
    },
    {
      "fieldId": "d7e82557-9045-5e92-a494-d99112bbec4a",
      "value": "Care of the building"
    },
    {
      "fieldId": "8aa3eba2-204b-5ebd-ba7a-be0f066027d6",
      "value": "We will leave the building in no worse condition than we found it. Installation work must be carried out carefully: minimum drilled holes, no continuous re-drilling into the same plaster, and all fixings made good when removed. The member with Building Authority (R-001) has final say on what is and is not acceptable. This article cannot be weakened or removed without the explicit agreement of the Party Utility."
    },
    {
      "fieldId": "3340532b-d845-5e54-92b3-819ed05365c5",
      "value": "Our right to use this space depends on the trust of the Party Utility and the building community. Demonstrating care of the building is not optional — it is the basis on which the experiment is allowed to continue."
    },
    {
      "fieldId": "1f01bc6b-39c8-58d7-b1a3-79142623fece",
      "value": "Unanimous agreement of all current members AND agreement of the Party Utility."
    },
    {
      "fieldId": "0df40543-f72a-5471-a7f1-c85c1f1f93e4",
      "value": "Protected — requires Party Utility agreement to amend"
    },
    {
      "fieldId": "aee7afe9-6650-5fa4-a61a-495c3b88994b",
      "value": "active"
    }
  ],
  "instanceId": "c503fae5-c3ab-452e-a0b4-5682ca204288",
  "typeId": "a1142ac3-5385-5c0e-8630-1dd3432cdf7f",
  "typeName": "article",
  "typeNamespace": "governance",
  "typeVersion": 1,
  "updatedAt": "2026-05-31T14:55:35.188979267+00:00"
}