{
  "$schema": "https://srs.semanticops.com/schema/2.0/record.json",
  "instanceId": "e1000027-0000-4000-a000-000000000027",
  "typeId": "2a000006-0000-4000-a000-000000000006",
  "typeVersion": 1,
  "typeNamespace": "com.semanticops.spec",
  "typeName": "invariant",
  "fieldValues": [
    {
      "fieldId": "1a000020-0000-4000-a000-000000000020",
      "value": 27
    },
    {
      "fieldId": "1a000001-0000-4000-a000-000000000001",
      "value": "FieldGroupValue.entries list must satisfy FieldGroup.minItems and\u2026"
    },
    {
      "fieldId": "1a000003-0000-4000-a000-000000000003",
      "value": "A `FieldGroupValue.entries` list must satisfy `FieldGroup.minItems` and `maxItems` where specified."
    },
    {
      "fieldId": "1a000021-0000-4000-a000-000000000021",
      "value": "ext:field-groups"
    }
  ],
  "sourceRefs": [
    {
      "sourceType": "repository-document",
      "sourceId": "a1b2c3d4-e5f6-4a7b-8c9d-0e1f2a3b4c5d",
      "relationType": "evidence",
      "note": "Invariant 27 from srs-spec.md section 08"
    }
  ],
  "createdAt": "2026-05-27T00:00:00Z"
}
