{
  "$schema": "https://srs.semanticops.com/schema/2.0/record.json",
  "instanceId": "7d22d50f-2dc2-51cb-ac43-dd1b0903d869",
  "typeId": "b01527f9-1a4c-5e5f-8a36-29e7ae7c51c4",
  "typeVersion": 1,
  "typeNamespace": "com.semanticops.srs",
  "typeName": "meta.subsection",
  "fieldValues": [
    {
      "fieldId": "96f04d9d-9432-5628-8664-0d92e50f6fd0",
      "value": "Name convention"
    },
    {
      "fieldId": "436786e4-d51e-5275-9654-bc4b5ee82b1a",
      "value": "Field and Type names are programmatic keys in `snake_case`. Names are stable within a namespace and version lineage. A new name means a new definition.\n\n---"
    }
  ],
  "sourceRefs": [
    {
      "sourceType": "repository-document",
      "sourceId": "a1b2c3d4-e5f6-4a7b-8c9d-0e1f2a3b4c5d",
      "relationType": "evidence",
      "note": "Subsection 02-4 from srs-spec.md - coarse source anchoring during migration"
    }
  ],
  "createdAt": "2026-05-27T00:00:00Z"
}
