{
  "$schema": "https://srs.semanticops.com/schema/2.0/record.json",
  "instanceId": "cd8fdb47-61c6-51e5-8b9a-31f7745b1b42",
  "typeId": "b01527f9-1a4c-5e5f-8a36-29e7ae7c51c4",
  "typeVersion": 1,
  "typeNamespace": "com.semanticops.srs",
  "typeName": "meta.subsection",
  "fieldValues": [
    {
      "fieldId": "96f04d9d-9432-5628-8664-0d92e50f6fd0",
      "value": "Type inheritance (ext:type-inheritance)"
    },
    {
      "fieldId": "436786e4-d51e-5275-9654-bc4b5ee82b1a",
      "value": "**39.** `Type.extendsTypeId`, when present, must reference a valid `Type.id`. Inheritance chains must be acyclic; a Type may not directly or transitively extend itself.\n\n**40.** A specializing Type must not declare a `fieldId` in its own `fields[]` that duplicates any `fieldId` inherited from its base Type or any ancestor Type.\n\n**41.** When `Type.fieldOrder` is present, it must contain exactly the set of field UUIDs in the Type's effective field list. No UUID may appear more than once, and no UUID from the effective field list may be absent.\n\n**42.** Every `fieldId` in `Type.fieldAssignmentOverrides[]` must reference a field inherited from the base Type or an ancestor Type. Overrides must not reference fields declared in the specializing Type's own `fields[]`, must not alter Field semantics, and must not relax an inherited required field from `true` to `false`.\n\n**43.** When `ext:type-inheritance` is declared, `Package.dependencyRefs` must include a `Reference` for every Type in the transitive closure of base Types for any Type in `Package.types[]`. If `mode === \"bundled\"`, all such base Types must be present in `types[]`."
    }
  ],
  "sourceRefs": [
    {
      "sourceType": "repository-document",
      "sourceId": "a1b2c3d4-e5f6-4a7b-8c9d-0e1f2a3b4c5d",
      "relationType": "evidence",
      "note": "Subsection 08-20 from srs-spec.md - coarse source anchoring during migration"
    }
  ],
  "createdAt": "2026-05-27T00:00:00Z"
}
