{
  "$schema": "https://srs.semanticops.com/schema/2.0/record.json",
  "instanceId": "e1000059-0000-4000-a000-000000000059",
  "typeId": "2a000006-0000-4000-a000-000000000006",
  "typeVersion": 1,
  "typeNamespace": "com.semanticops.spec",
  "typeName": "invariant",
  "fieldValues": [
    {
      "fieldId": "1a000020-0000-4000-a000-000000000020",
      "value": 59
    },
    {
      "fieldId": "1a000001-0000-4000-a000-000000000001",
      "value": "FederationEvent with event === \"merge\" or event === \"import\" must\u2026"
    },
    {
      "fieldId": "1a000003-0000-4000-a000-000000000003",
      "value": "A `FederationEvent` with `event === \"merge\"` or `event === \"import\"` must declare `sourceRepositoryId`. A `FederationEvent` with `event === \"split\"` must declare `targetRepositoryId`. `affectedInstanceIds` must be non-empty for all event types."
    },
    {
      "fieldId": "1a000021-0000-4000-a000-000000000021",
      "value": "ext:federation"
    }
  ],
  "sourceRefs": [
    {
      "sourceType": "repository-document",
      "sourceId": "a1b2c3d4-e5f6-4a7b-8c9d-0e1f2a3b4c5d",
      "relationType": "evidence",
      "note": "Invariant 59 from srs-spec.md section 08"
    }
  ],
  "createdAt": "2026-05-27T00:00:00Z"
}
