{
  "$schema": "https://srs.semanticops.com/schema/2.0/record.json",
  "instanceId": "fe0810ac-5ba0-5a37-8ab2-a845ea96b3af",
  "typeId": "b01527f9-1a4c-5e5f-8a36-29e7ae7c51c4",
  "typeVersion": 1,
  "typeNamespace": "com.semanticops.srs",
  "typeName": "meta.subsection",
  "fieldValues": [
    {
      "fieldId": "96f04d9d-9432-5628-8664-0d92e50f6fd0",
      "value": "Distribution — Views L2 (ext:views-l2)"
    },
    {
      "fieldId": "436786e4-d51e-5275-9654-bc4b5ee82b1a",
      "value": "**35.** Every `DocumentSection.renderViewId` in any `DocumentView` within `Package.documentViews[]` must reference a `View.id` that appears in `Package.views[]` or `Package.dependencyRefs`. If `mode === \"bundled\"`, that `View` must be present in `Package.views[]`."
    }
  ],
  "sourceRefs": [
    {
      "sourceType": "repository-document",
      "sourceId": "a1b2c3d4-e5f6-4a7b-8c9d-0e1f2a3b4c5d",
      "relationType": "evidence",
      "note": "Subsection 08-16 from srs-spec.md - coarse source anchoring during migration"
    }
  ],
  "createdAt": "2026-05-27T00:00:00Z"
}
