{
  "$schema": "https://srs.semanticops.com/schema/2.0/record.json",
  "instanceId": "f1000002-0000-4000-a000-000000000002",
  "typeId": "2a000012-0000-4000-a000-000000000012",
  "typeVersion": 1,
  "typeNamespace": "com.semanticops.spec",
  "typeName": "design-note",
  "fieldValues": [
    {
      "fieldId": "1a000001-0000-4000-a000-000000000001",
      "value": "Design Decisions"
    },
    {
      "fieldId": "1a000002-0000-4000-a000-000000000002",
      "value": ""
    }
  ],
  "sourceRefs": [
    {
      "sourceType": "repository-document",
      "sourceId": "a1b2c3d4-e5f6-4a7b-8c9d-0e1f2a3b4c5d",
      "relationType": "evidence",
      "note": "Imported from scds-rationale.md: \"Design Decisions\""
    }
  ],
  "createdAt": "2026-05-27T00:00:00Z"
}
