{
  "$schema": "https://srs.semanticops.com/schema/2.0/record.json",
  "instanceId": "4f3fdbd8-e155-51d6-8488-4708b2e5c1c4",
  "typeId": "6a000006-0000-4000-a000-000000000006",
  "typeVersion": 1,
  "typeNamespace": "com.semanticops.spec",
  "typeName": "rfc-proposed-artifact",
  "fieldValues": [
    {
      "fieldId": "1a000001-0000-4000-a000-000000000001",
      "value": "RFC-004 Artifact: field-schema"
    },
    {
      "fieldId": "5a000017-0000-4000-a000-000000000017",
      "value": "schema"
    },
    {
      "fieldId": "5a000016-0000-4000-a000-000000000016",
      "value": "rfcs/rfc-004/proposed-schemas/field.json"
    },
    {
      "fieldId": "1a000012-0000-4000-a000-000000000012",
      "value": "Proposed root Field schema update adding `json` to Field.valueType."
    }
  ],
  "createdAt": "2026-05-27T00:00:00Z",
  "sourceRefs": [
    {
      "sourceType": "repository-document",
      "sourceId": "a4b5c6d7-e8f9-4a0b-8c2d-3e4f5a6b7c8d",
      "relationType": "derived-from",
      "note": "Structured RFC-004 process record derived from the RFC-004 proposal content."
    }
  ]
}
